{
  "$schema": "https://nomue.ai/id/schema/independent-two-group-record/0.1.0-draft.1",
  "record_type": "nomue-record",
  "record_id": "urn:example:record:welch-domain-magnitude-inside",
  "revision_id": "urn:example:revision:welch-domain-magnitude-inside:composition-1",
  "created_at": "2026-09-27T00:00:00Z",
  "interpretation_bundle_id": "https://nomue.ai/id/bundle/independent-two-group/0.1.0-draft.1",
  "profile_id": "https://nomue.ai/id/profile/independent-two-group-continuous/0.1.0-draft.1",
  "payload": {
    "dataset": {
      "dataset_id": "dataset-1",
      "observations": [
        {
          "observation_id": "observation-1",
          "experimental_unit_id": "unit-1",
          "group_id": "group-a",
          "outcome_value": 1.8092513943330656e+75
        },
        {
          "observation_id": "observation-2",
          "experimental_unit_id": "unit-2",
          "group_id": "group-a",
          "outcome_value": 9.046256971665328e+74
        },
        {
          "observation_id": "observation-3",
          "experimental_unit_id": "unit-3",
          "group_id": "group-a",
          "outcome_value": 4.523128485832664e+74
        },
        {
          "observation_id": "observation-4",
          "experimental_unit_id": "unit-4",
          "group_id": "group-b",
          "outcome_value": 0.0
        },
        {
          "observation_id": "observation-5",
          "experimental_unit_id": "unit-5",
          "group_id": "group-b",
          "outcome_value": 4.523128485832664e+74
        },
        {
          "observation_id": "observation-6",
          "experimental_unit_id": "unit-6",
          "group_id": "group-b",
          "outcome_value": 9.046256971665328e+74
        }
      ]
    },
    "design": {
      "design_id": "design-1",
      "dataset_id": "dataset-1",
      "experimental_unit_type": "biological replicate",
      "groups": [
        {
          "group_id": "group-a",
          "label": "Control"
        },
        {
          "group_id": "group-b",
          "label": "Treatment"
        }
      ],
      "group_order": [
        "group-a",
        "group-b"
      ],
      "outcome": {
        "outcome_id": "outcome-1",
        "label": "Synthetic continuous outcome",
        "scale": "continuous"
      },
      "declarations": {
        "grouping_structure": "independent_groups",
        "pairing": "none",
        "repeated_measurements": "none",
        "clustering": "none_declared"
      },
      "data_handling": {
        "analysis_population": "all_record_observations",
        "missing_outcomes": "none",
        "transformation": "none",
        "weighting": "none"
      }
    },
    "analysis": {
      "analysis_id": "analysis-1",
      "design_id": "design-1",
      "contract_id": "https://nomue.ai/id/contract/independent-two-group/0.1.0-draft.1",
      "alternative": "two_sided",
      "estimand": {
        "kind": "unstandardized_arithmetic_mean_difference",
        "direction": "group_order_first_minus_second"
      },
      "confidence_level": 0.95
    },
    "result": {
      "result_id": "result-1",
      "analysis_id": "analysis-1",
      "group_summaries": [
        {
          "group_id": "group-a",
          "n": 3,
          "mean": 1.0553966466942883e+75,
          "sample_variance": 4.773694636515206e+149
        },
        {
          "group_id": "group-b",
          "n": 3,
          "mean": 4.523128485832664e+74,
          "sample_variance": 2.0458691299350887e+149
        }
      ],
      "effect_estimate": {
        "kind": "unstandardized_arithmetic_mean_difference",
        "estimate": 6.030837981110219e+74,
        "standard_error": 4.767796054939953e+74,
        "confidence_interval": {
          "method_id": "urn:nomue:method:welch-satterthwaite-mean-difference-ci:1",
          "confidence_level": 0.95,
          "lower": -8.085321122686767e+74,
          "upper": 2.0146997084907205e+75
        }
      },
      "test": {
        "test_statistic": 1.264911064067352,
        "degrees_of_freedom": 3.4482758620689653,
        "p_value": 0.28462717876142213
      }
    }
  },
  "integrity": {
    "canonicalization_id": "urn:nomue:canonicalization:jcs:0.2.0-draft.1",
    "digest_algorithm": "sha-256",
    "digest_scope": "record_without_integrity",
    "content_digest": "sha256:bc617eb8d42e59c75b18533822871f62696b8efbf8b8ae1fab80b69918033a9e"
  }
}
