{
  "$schema": "https://nomue.ai/id/schema/independent-two-group-record/0.1.0-draft.1",
  "record_type": "nomue-record",
  "record_id": "urn:example:record:welch-domain-kappa-d-inside",
  "revision_id": "urn:example:revision:welch-domain-kappa-d-inside:composition-1",
  "created_at": "2026-09-27T00:00:00Z",
  "interpretation_bundle_id": "https://nomue.ai/id/bundle/independent-two-group/0.1.0-draft.1",
  "profile_id": "https://nomue.ai/id/profile/independent-two-group-continuous/0.1.0-draft.1",
  "payload": {
    "dataset": {
      "dataset_id": "dataset-1",
      "observations": [
        {
          "observation_id": "observation-1",
          "experimental_unit_id": "unit-1",
          "group_id": "group-a",
          "outcome_value": 99999.0
        },
        {
          "observation_id": "observation-2",
          "experimental_unit_id": "unit-2",
          "group_id": "group-a",
          "outcome_value": 100001.0
        },
        {
          "observation_id": "observation-3",
          "experimental_unit_id": "unit-3",
          "group_id": "group-b",
          "outcome_value": 900000.0
        },
        {
          "observation_id": "observation-4",
          "experimental_unit_id": "unit-4",
          "group_id": "group-b",
          "outcome_value": 900000.0
        }
      ]
    },
    "design": {
      "design_id": "design-1",
      "dataset_id": "dataset-1",
      "experimental_unit_type": "biological replicate",
      "groups": [
        {
          "group_id": "group-a",
          "label": "Control"
        },
        {
          "group_id": "group-b",
          "label": "Treatment"
        }
      ],
      "group_order": [
        "group-a",
        "group-b"
      ],
      "outcome": {
        "outcome_id": "outcome-1",
        "label": "Synthetic continuous outcome",
        "scale": "continuous"
      },
      "declarations": {
        "grouping_structure": "independent_groups",
        "pairing": "none",
        "repeated_measurements": "none",
        "clustering": "none_declared"
      },
      "data_handling": {
        "analysis_population": "all_record_observations",
        "missing_outcomes": "none",
        "transformation": "none",
        "weighting": "none"
      }
    },
    "analysis": {
      "analysis_id": "analysis-1",
      "design_id": "design-1",
      "contract_id": "https://nomue.ai/id/contract/independent-two-group/0.1.0-draft.1",
      "alternative": "two_sided",
      "estimand": {
        "kind": "unstandardized_arithmetic_mean_difference",
        "direction": "group_order_first_minus_second"
      },
      "confidence_level": 0.95
    },
    "result": {
      "result_id": "result-1",
      "analysis_id": "analysis-1",
      "group_summaries": [
        {
          "group_id": "group-a",
          "n": 2,
          "mean": 100000.0,
          "sample_variance": 2.0
        },
        {
          "group_id": "group-b",
          "n": 2,
          "mean": 900000.0,
          "sample_variance": 0.0
        }
      ],
      "effect_estimate": {
        "kind": "unstandardized_arithmetic_mean_difference",
        "estimate": -800000.0,
        "standard_error": 1.0,
        "confidence_interval": {
          "method_id": "urn:nomue:method:welch-satterthwaite-mean-difference-ci:1",
          "confidence_level": 0.95,
          "lower": -800012.7062047361,
          "upper": -799987.2937952639
        }
      },
      "test": {
        "test_statistic": -800000.0,
        "degrees_of_freedom": 1.0,
        "p_value": 7.957747154590623e-07
      }
    }
  },
  "integrity": {
    "canonicalization_id": "urn:nomue:canonicalization:jcs:0.2.0-draft.1",
    "digest_algorithm": "sha-256",
    "digest_scope": "record_without_integrity",
    "content_digest": "sha256:ba15c5c28fe4e8576daf6369055bb89c4eca5b4e8518d180f9c6902073fec0d0"
  }
}
